id,abstract,author,cites,cites_id,journal,number,pages,publisher,title,url,volume,year,citation_link,id_citations1019176,"The Mediterranean-type oak/grass savanna of California is composed of widely spaced oak trees with understory grasses. These savanna regions are interspersed with large areas of more open grasslands. The ability of remotely sensed data (with various spatial resolutions) to monitor the phenology in these water-limited oak/grass savannas and open grasslands is explored over the 2012–2015 timeframe using data from Landsat (30 m), the MODerate resolution Imaging Spectroradiometer (MODIS – gridded 500 m), and the Visible Infrared Imaging Radiometer Suite (VIIRS – gridded 500 m) data. Vegetation phenology detected from near-ground level, webcam based PhenoCam imagery from two sites in the Ameriflux Network (long-term flux measurement network of the Americas) (Tonzi Ranch and Vaira Ranch) is upscaled, using a National Agriculture Imagery Program (NAIP) aerial image (1 m), to evaluate the …",Yan Liu and Michael J Hill and Xiaoyang Zhang and Zhuosen Wang and Andrew D Richardson and Koen Hufkens and Gianluca Filippa and Dennis D Baldocchi and Siyan Ma and Joseph Verfaillie and Crystal B Schaaf,73,2425793938681019347,Agricultural and Forest Meteorology,,311-325,Elsevier,"Using data from Landsat, MODIS, VIIRS and PhenoCams to monitor the phenology of California oak/grass savanna and open grassland across spatial scales",https://www.sciencedirect.com/science/article/pii/S0168192317300692,237,2017,/scholar?cites=2425793938681019347,dJ8MMFoAAAAJ:hpaAfPMapO8C
1019177,"FLUXNET, the global network of eddy covariance flux towers, provides the largest synthesized data set of CO2, H2O, and energy fluxes. To achieve the ultimate goal of providing flux information “everywhere and all of the time,” studies have attempted to address the representativeness issue, i.e., whether measurements taken in a set of given locations and measurement periods can be extrapolated to a space‐ and time‐explicit extent (e.g., terrestrial globe, 1982–2013 climatological baseline). This study focuses on the temporal representativeness of FLUXNET and tests whether site‐specific measurement periods are sufficient to capture the natural variability of climatological and biological conditions. FLUXNET is unevenly representative across sites in terms of the measurement lengths and potentials of extrapolation in time. Similarity of driver conditions among years generally enables the extrapolation of flux …",Housen Chu and Dennis D Baldocchi and Ranjeet John and Sebastian Wolf and Markus Reichstein,73,12046584530264842992,Journal of Geophysical Research: Biogeosciences,2,289-307,,Fluxes all of the time? A primer on the temporal representativeness of FLUXNET,https://agupubs.onlinelibrary.wiley.com/doi/abs/10.1002/2016JG003576,122,2017,/scholar?cites=12046584530264842992,dJ8MMFoAAAAJ:kkE12xK_jI8C
1019178,"FLUXNET15, the latest update of the longest global record of ecosystem carbon, water, and energy fluxes, features improved data quality, new data products, and more open data sharing policies.",Gilberto Pastorello and Dario Papale and Housen Chu and Carlo Trotta and Deborah Agarwal and Eleonora Canfora and Dennis Baldocchi and Margaret Torn,72,4773158551222344695,"Eos, Transactions American Geophysical Union (Online)",8,,"Lawrence Berkeley National Lab.(LBNL), Berkeley, CA (United States)",A new data set to keep a sharper eye on land-air exchanges,https://www.osti.gov/servlets/purl/1465409,98,2017,/scholar?cites=4773158551222344695,dJ8MMFoAAAAJ:kugM79TKeU4C
1019179,"Simple but realistic modeling of radiation transfer within heterogeneous canopy has been a challenging research question for decades and is critical for predicting ecological processes such as photosynthesis. The Markov model proposed by [Nilson, T., 1971. A theoretical analysis of the frequency of gaps in plant stands. Agric. Meteorol. 8, 25–38] is theoretically sound to meet this challenge. However, it has not been widely used because of the difficulty of determining the clumping factor. We propose an analytical approach to calculate clumping factors based on the average characteristics of vegetation distributed across a landscape. In a savanna woodland in California, we simulate the photosynthesis of the landscape in three different ways: (1) the crown envelope and location of each tree is spatially explicitly specified, (2) the canopy is assumed to be horizontally homogeneous within which leaves are randomly …",Qi Chen and Dennis Baldocchi and Peng Gong and Todd Dawson,72,16726420945057796220,agricultural and forest meteorology,6-7,1005-1020,Elsevier,Modeling radiation and photosynthesis of a heterogeneous savanna woodland landscape with a hierarchy of model complexities,https://www.sciencedirect.com/science/article/pii/S0168192308000385,148,2008,/scholar?cites=16726420945057796220,dJ8MMFoAAAAJ:SdhP9T11ey4C
1019180,"This paper presents information on turbulence spectra derived from measurements made with an instrument array including a prototype rapid-response CO2 sensor over a deciduous forest on complex terrain near Oak Ridge, TN. When compared to measurements from previous studies over flat terrain, velocity spectra appeared to be shifted toward lower frequencies. This tendency was especially apparent in lateral and vertical velocity spectra. Peaks occurred around f = 0.035–0.07 (where f is the non-dimensional frequency) in all spectra measured under near neutral conditions, except for vertical velocity which had a peak near f ≈ 0.16. Cospectra of sensible heat, water vapor and CO2 measured during near neutral conditions were similar in shape and had peak frequencies near f ≈ 0.10–0.15. As thermal stability changed from near neutral to unstable conditions the spectral peaks generally shifted toward lower …",Dean E Anderson and Shashi B Verma and Robert J Clement and Dennis D Baldocchi and Detlef R Matt,70,15073550793417143049,Agricultural and Forest Meteorology,1-3,81-99,Elsevier,"Turbulence spectra of CO2, water vapor, temperature and velocity over a deciduous forest",https://www.sciencedirect.com/science/article/pii/0168192386900511,38,1986,/scholar?cites=15073550793417143049,dJ8MMFoAAAAJ:SP6oXDckpogC
1019181,"The exchange of carbon dioxide is a key measure of ecosystem metabolism and a critical intersection between the terrestrial biosphere and the Earth's climate. Despite the general agreement that the terrestrial ecosystems in North America provide a sizeable carbon sink, the size and distribution of the sink remain uncertain. We use a data-driven approach to upscale eddy covariance flux observations from towers to the continental scale by integrating flux observations, meteorology, stand age, aboveground biomass, and a proxy for canopy nitrogen concentrations from AmeriFlux and Fluxnet-Canada Research Network as well as a variety of satellite data streams from the MODIS sensors. We then use the resulting gridded flux estimates from March 2000 to December 2012 to assess the magnitude, distribution, and interannual variability of carbon fluxes for the U.S. and Canada. The mean annual gross primary …",Jingfeng Xiao and Scott V Ollinger and Steve Frolking and George C Hurtt and David Y Hollinger and Kenneth J Davis and Yude Pan and Xiaoyang Zhang and Feng Deng and Jiquan Chen and Dennis D Baldocchi and Bevery E Law and M Altaf Arain and Ankur R Desai and Andrew D Richardson and Ge Sun and Brian Amiro and Hank Margolis and Lianhong Gu and Russell L Scott and Peter D Blanken and Andrew E Suyker,69,18296056537020317714,Agricultural and Forest Meteorology,,142-157,Elsevier,Data-driven diagnostics of terrestrial carbon dynamics over North America,https://www.sciencedirect.com/science/article/pii/S0168192314001671,197,2014,/scholar?cites=18296056537020317714,dJ8MMFoAAAAJ:hQUaER0FWQ4C
1019182,"History has shown that many of the technological advances in micrometeorological measurement methods and techniques were facilitated by agronomic research into understanding plant–water relationships and photosynthesis. The most commonly used micrometeorological methods can be separated into four categories. They are eddy covariance, flux‐gradient, accumulation, and mass balance. First introduced by Businger and Oncley, the conditional sampling or REA method is a modified version of the eddy accumulation technique. There are several gradient methods that are used to assess the vertical turbulent flux. The chapter presents and discusses the Bowen‐ratio energy balance (BREB), modified Bowen‐ratio, and aerodynamic methods. These methods rely on the relationship between turbulent fluxes and vertical time average gradients, much in the same way molecular diffusion can be described by a …",Tilden P Meyers and Dennis D Baldocchi,69,1945449564905771834,Micrometeorology in agricultural systems,,381-396,"American Society of Agronomy, Crop Science Society of America, and Soil Science Society of America",Current micrometeorological flux methodologies with applications in agriculture,https://acsess.onlinelibrary.wiley.com/doi/abs/10.2134/agronmonogr47.c16,47,2005,/scholar?cites=1945449564905771834,dJ8MMFoAAAAJ:eflP2zaiRacC
1019183,"The goals of this paper are to briefly describe experimental methods that are used to measure SO2 dry deposition, and to discuss the physical, biological and chemical processes that control SO2 deposition fluxes over vegetation and to describe how these fluxes are modelled. The predominant pathway for gaseous SO2 uptake to dry vegetation is via turbulent transfer through the atmosphere surface boundary layer and molecular diffusion through the leaf laminar boundary layer and the stomata. The soil surface is a significant, but weaker sink for sulphur, especially when frozen or covered with snow. The appreciable solubility of SO2 causes its uptake to be enhanced greatly in the presence of moisture on leaves and the soil. The aqueous uptake of SO2, however, causes the pH of a solution to decrease which in turn produces a reduction in the solubility of SO2. Neutralising species (ammonia, inner plant species …",Jan Willem Erisman and Dennis Baldocchi,69,6352197004339131417,Tellus B,3,159-171,Munksgaard International Publishers,Modelling dry deposition of SO2,https://onlinelibrary.wiley.com/doi/abs/10.1034/j.1600-0889.1994.t01-2-00001.x,46,1994,/scholar?cites=6352197004339131417,dJ8MMFoAAAAJ:t6usbXjVLHcC
1019184,"A field campaign was carried out near Boardman, Oregon, to study the effects of subgrid-scale variability of sensible- and latent-heat fluxes on surface boundary-layer properties. The experiment involved three U.S. Department of Energy laboratories, one National Oceanic and Atmospheric Administration laboratory, and several universities. The experiment was conducted in a region of severe contrasts in adjacent surface types that accentuated the response of the atmosphere to variable surface forcing. Large values of sensible-heat flux and low values of latent-heat flux characterized a sagebrush steppe area; significantly smaller sensible-heat fluxes and much larger latent-heat fluxes were associated with extensive tracts of irrigated farmland to the north, east, and west of the steppe. Data were obtained from an array of surface flux stations, remote-sensing devices, an instrumented aircraft, and soil and vegetation …",JC Doran and FJ Barnes and RL Coulter and TL Crawford and DD Baldocchi and L Balick and DR Cook and D Cooper and RJ Dobosy and WA Dugas and L Fritschen and RL Hart and L Hipps and JM Hubbe and W Gao and R Hicks and RR Kirkham and KE Kunkel and TJ Martin and TP Meyers and W Porch and JD Shannon and WJ Shaw and E Swiatek and CD Whiteman,69,10650183757946594794,Bulletin of the American Meteorological Society,11,1785-1796,American Meteorological Society,The Boardman regional flux experiment,https://journals.ametsoc.org/bams/article/73/11/1785/53960,73,1992,/scholar?cites=10650183757946594794,dJ8MMFoAAAAJ:D_sINldO8mEC
1019185,"Directionality in coupling, defined as the linkage relating causes to their effects at a later time, can be used to explain the core dynamics of ecological systems by untangling direct and feedback relationships between the different components of the systems. Inferring causality from measured ecological variables sampled through time remains a formidable challenge further made difficult by the action of periodic drivers overlapping the natural dynamics of the system. Periodicity in the drivers can often mask the self-sustained oscillations originating from the autonomous dynamics. While linear and direct causal relationships are commonly addressed in the time domain, using the well-established machinery of Granger causality (G-causality), the presence of periodic forcing requires frequency-based statistics (e.g., the Fourier transform), able to distinguish coupling induced by oscillations in external drivers from genuine …",Matteo Detto and Annalisa Molini and Gabriel Katul and Paul Stoy and Sari Palmroth and Dennis Baldocchi,68,11818600716931927769,The American Naturalist,4,524-535,University of Chicago Press,Causality and persistence in ecological systems: a nonparametric spectral Granger causality approach,https://www.journals.uchicago.edu/doi/abs/10.1086/664628,179,2012,/scholar?cites=11818600716931927769,dJ8MMFoAAAAJ:kVjdVfd2voEC
1019186,"A plant canopy consists of an assemblage of plants with leaves that possess a particular spatial distribution and assortment of angle orientations (de Wit, 1965; Monsi et al., 1973). How a collection of leaves intercepts sunlight and uses light energy to assimilate CO2 is the basis of canopy photosynthesis. The major factors affecting canopy photosynthesis, through light interception, include the angular relationship between leaves and Earth—sun geometry and the leaves’ vertical and horizontal positions. Other factors affecting canopy photosynthesis include environmental conditions (temperature, wind speed, humidity, and CO2 concentration), the life history of leaves, the availability of soil moisture and nutrients, stomatal conductance, and speciﬁc photosynthetic pathways (Schulze, 1986; Gutschick, 1991; Stenberg et al., 1995). The complexity of canopy photosynthesis can be illustrated with a closed canopy on a fair day during the growing season. Inside the canopy some leaves are fully sunlit, others are exposed to frequent sunﬂecks, and the re-mainder exist in deep, but occasionally punctuated, shade (Chazdon, I988; Oker~ Blom et al., 1991). Many sunlit leaves of C3 species will experience saturated rates of carboxylation if CO2 supply is limited (Farquhar and von Caemmerer, 1982). Furthermore, sunlit leaves are often warmer than shaded leaves. This situation promotes dark respiration (Amthor, 1994), de-creases the solubility of CO2 relative to O2 (Farquhar et al., 1980), and de-creases the CO2 speciﬁcity factor of ribulose, bisphosphate, and carboxy-lase/oxygenase (rubisco)(Harley and Tenhunen, 1991). The photosynthetic response of …",Dennis D Baldocchi and Jeffrey S Amthor,68,3721905942582323045,"Terrestrial Global Productivity; Academic Press: New York, NY, USA",,9-31,,Canopy photosynthesis: history,http://books.google.com/books?hl=en&lr=&id=xvLZG_z4KUAC&oi=fnd&pg=PA9&dq=info:ZecIO7zdpjMJ:scholar.google.com&ots=q8l0sJuOgF&sig=B2IR9P28tS1TsV0WR87nBIHxaK0,,2001,/scholar?cites=3721905942582323045,dJ8MMFoAAAAJ:mvPsJ3kp5DgC
1019187,"During the summer of 1992, isoprene emissions were measured in a mixed deciduous forest near Oak Ridge, Tennessee. Measurements were aimed at the experimental scale‐up of emissions from the leaf level to the forest canopy to the mixed layer. Results from the scale‐up study are compared to different canopy models for determining the leaf microclimate as input to isoprene emission algorithms. These include (1) no canopy effects, (2) a simple vertical scaling canopy model with a leaf energy balance, and (3) a numerical canopy model which accounts for leaf‐sun geometries, photosynthesis, respiration, transpiration, and gas transport in the canopy. Initial evaluation of the models was based upon a standard emission rate factor of 90 μgC g−1 hr−1 (0.42 nmol g−1 s−1) taken from leaf cuvette measurements and a biomass density factor of 203 g m−2 taken from biomass surveys and a flux footprint analysis …",Brian Lamb and Thomas Pierce and Dennis Baldocchi and Eugene Allwine and Steve Dilts and Hal Westberg and Christopher Geron and Alex Guenther and Lee Klinger and Peter Harley and Pat Zimmerman,68,16447005745221761250,Journal of Geophysical Research: Atmospheres,D17,22787-22797,,Evaluation of forest canopy models for estimating isoprene emissions,https://agupubs.onlinelibrary.wiley.com/doi/abs/10.1029/96JD00056,101,1996,/scholar?cites=16447005745221761250,dJ8MMFoAAAAJ:LPZeul_q3PIC
1019188,"We present 6.5 years of eddy covariance measurements of fluxes of methane (FCH4) and carbon dioxide (FCO2) from a flooded rice paddy in Northern California, USA. A pronounced warming trend throughout the study associated with drought and record high temperatures strongly influenced carbon (C) budgets and provided insights into biophysical controls of FCO2 and FCH4. Wavelet analysis indicated that photosynthesis (gross ecosystem production, GEP) induced the diel pattern in FCH4, but soil temperature (Ts) modulated its amplitude. Forward stepwise linear models and neural networking modeling were used to assess the variables regulating seasonal FCH4. As expected due to their competence in modeling nonlinear relationships, neural network models explained considerably more of the variance in daily average FCH4 than linear models. During the growing season, GEP and water levels typically …",Sara Helen Knox and Jaclyn Hatala Matthes and Cove Sturtevant and Patricia Y Oikawa and Joseph Verfaillie and Dennis Baldocchi,66,15137711148021097381,Journal of Geophysical Research: Biogeosciences,3,978-1001,,Biophysical controls on interannual variability in ecosystem‐scale CO2 and CH4 exchange in a California rice paddy,https://agupubs.onlinelibrary.wiley.com/doi/abs/10.1002/2015JG003247,121,2016,/scholar?cites=15137711148021097381,dJ8MMFoAAAAJ:TesyEGJKHF4C
1019189,"Baldocchi, D., Hutchison, B., Matt, D. and McMillen, R., 1986. Seasonal variation in the statistics of photosynthetically active radiation penetration in an oak--hickory forest. Agric. For. Meteorol., 36: 343--361.The seasonal variability in the frequency distribution (FD) and higher order moments (eg, standard deviation, skewness and kurtosis) of photosynthetically active radiation (PAR) penetration in an oak--hickory forest were examined. In a leafless, wintertime forest the FD is unimodal and skewed. In a leafing forest, the FD is highly variable and is strongly skewed. This results from higher solar elevation angles enhancing PAR penetration and new, expanding leaves causing penumbral shade and scattering the incoming radiation. The FD of PAR in the fully-leafed canopy is unimodal in the upper canopy, bimodal below crown closure and unimodal in the subcanopy trunkspace. Low solar elevation angles and leaf senescence cause the FD of PAR in the autumnal canopy to be uniformly distributed, as is indicated by its low kurtosis. FDs of PAR also provide a means of estimating sunlit leaf area. Estimated values of sunlit leaf area below crown closure agree within 15% with theoretical estimates derived with a negative binomial distribution.",Dennis Baldocchi and Boyd Hutchison and Detlef Matt and Robert McMillen,66,7938541657672261717,Agricultural and Forest Meteorology,4,343-361,Elsevier,Seasonal variation in the statistics of photosynthetically active radiation penetration in an oak-hickory forest,https://nature.berkeley.edu/biometlab/pdf/ddb%201986%20agmet%20v36.pdf,36,1986,/scholar?cites=7938541657672261717,dJ8MMFoAAAAJ:KxtntwgDAa4C
1019190,"Methane (CH4) exchange in wetlands is complex, involving nonlinear asynchronous processes across diverse time scales. These processes and time scales are poorly characterized at the whole‐ecosystem level, yet are crucial for accurate representation of CH4 exchange in process models. We used a combination of wavelet analysis and information theory to analyze interactions between whole‐ecosystem CH4 flux and biophysical drivers in two restored wetlands of Northern California from hourly to seasonal time scales, explicitly questioning assumptions of linear, synchronous, single‐scale analysis. Although seasonal variability in CH4 exchange was dominantly and synchronously controlled by soil temperature, water table fluctuations, and plant activity were important synchronous and asynchronous controls at shorter time scales that propagated to the seasonal scale. Intermittent, subsurface water table …",Cove Sturtevant and Benjamin L Ruddell and Sara Helen Knox and Joseph Verfaillie and Jaclyn Hatala Matthes and Patricia Y Oikawa and Dennis Baldocchi,65,2967989340136899172,Journal of Geophysical Research: Biogeosciences,1,188-204,,"Identifying scale‐emergent, nonlinear, asynchronous processes of wetland methane exchange",https://agupubs.onlinelibrary.wiley.com/doi/abs/10.1002/2015JG003054,121,2016,/scholar?cites=2967989340136899172,dJ8MMFoAAAAJ:EaFouW7jFu4C
1019191,"Ecosystem respiration (Reco) is highly variable in semiarid ecosystems. After a period of drought, Reco can jump to a high value in response to rain events, and afterward it decays exponentially with time. To better understand the timing, size, and duration of rain-induced respiration pulses, we examined 57 rain events from over 23 site-years of eddy covariance measurements at an open annual grassland, a woodland understory, and a peatland pasture in California, USA. To explain these findings, we conducted a factorial litter-watering experiment on grass and soil plots exposure to varying amounts of sunlight and water. To interpret and compare the population of rain-induced respiration pulses, we fitted the data with a two pool, 4-parameter exponential decay model.At the field scale, the total amounts of CO2 emission emanating from a single and sustained respiration pulse (mean ± standard deviation) were 44 …",Siyan Ma and Dennis D Baldocchi and Jaclyn A Hatala and Matteo Detto and Jorge Curiel Yuste,65,900145277561756919,Agricultural and Forest Meteorology,,203-213,Elsevier,Are rain-induced ecosystem respiration pulses enhanced by legacies of antecedent photodegradation in semi-arid environments?,https://www.sciencedirect.com/science/article/pii/S0168192311003364,154,2012,/scholar?cites=900145277561756919,dJ8MMFoAAAAJ:oNZyr7d5Mn4C
1019192,"It is well known that microbial-mediated soil respiration, the major source of CO2 from terrestrial ecosystems, is sensitive to temperature. Here, we hypothesize that some mechanisms, such as acclimation of microbial respiration to temperature and/or regulation by plant fresh C inputs of the temperature sensitivity of decomposition of soil organic matter (SOM), should be taken into account to predict soil respiration correctly. Specifically, two hypotheses were tested: (1) under warm conditions, temperature sensitivity (Q10) and basal rates of microbial-mediated soil respiration (Bs20, respiration at a given temperature) would be primarily subjected to presence/absence of plant fresh C inputs; and (2) under cold conditions, where labile C depletion occurred more slowly, microbial-mediated soil respiration could adjust its optimal temperatures to colder temperatures (acclimation), resulting in a net increase of …",J Curiel Yuste and S Ma and DD Baldocchi,65,4384797492547744438,Biogeochemistry,1-3,127-138,Springer Netherlands,Plant-soil interactions and acclimation to temperature of microbial-mediated soil respiration may affect predictions of soil CO2 efflux,https://link.springer.com/article/10.1007/s10533-009-9381-1,98,2010,/scholar?cites=4384797492547744438,dJ8MMFoAAAAJ:dQ2og3OwTAUC
1019193,"The rate at which isoprene is emitted by a forest depends on an array of environmental variables, the forest’s biomass, and its species composition. At present it is unclear whether errors in canopy-scale and process-level isoprene emission models are due to inadequacies in leaf-to-canopy integration theory or the imperfect assessment of the isoprene-emitting biomass in the flux footprint. To address this issue, an isoprene emission model (CANVEG) was tested over a uniform aspen stand and a mixed-species, broad-leaved forest.The isoprene emission model consists of coupled micrometeorological and physiological modules. The micrometeorological module computes leaf and soil energy exchange, turbulent diffusion, scalar concentration profiles, and radiative transfer through the canopy. Environmental variables that are computed by the micrometeorological module, in turn, drive physiological …",Dennis D Baldocchi and Jose D Fuentes and David R Bowling and Andrew A Turnipseed and Russell K Monson,64,8942313218192427495,Journal of Applied Meteorology,7,885-898,,Scaling isoprene fluxes from leaves to canopies: Test cases over a boreal aspen and a mixed species temperate forest,https://journals.ametsoc.org/jamc/article/38/7/885/15844,38,1999,/scholar?cites=8942313218192427495,dJ8MMFoAAAAJ:l7t_Zn2s7bgC
