id,abstract,author,cites,cites_id,journal,number,pages,publisher,title,url,volume,year,citation_link,id_citations1025022,"Dans cet article, nous présentons une approche hybride pour la translitération de l’arabizi algérien. Nous avons élaboré un ensemble de règles permettant le passage de l’arabizi vers l’arabe. Á partir de ces règles nous générons un ensemble de candidats pour la translitération de chaque mot en arabizi vers l’arabe, et un parmi ces candidats sera ensuite identifié et extrait comme le meilleur candidat. Cette approche a été expérimentée en utilisant trois corpus de tests. Les résultats obtenus montrent une amélioration du score de précision qui était pour le meilleur des cas de l’ordre de 75, 11%. Ces résultats ont aussi permis de vérifier que notre approche est très compétitive par rapport aux travaux traitant de la translitération de l’arabizi en général.",Imane Guellil and Faical Azouaou and Fodil Benali and Ala-Eddine Hachani and Houda Saadane,8,5149779792820003609,,,,,Approche hybride pour la translitération de l’arabizi algérien: une étude préliminaire,https://hal.archives-ouvertes.fr/hal-01837234/document,,2018,/scholar?cites=5149779792820003609,IaLjS0kAAAAJ:7BrZ7Jt4UNcC
1025023,"This artide aims at presenting the formalisms we defined for annotation-based training memories within the MICA project. It elaborates the objectives of the project and the requirements these objectives put on the tool to be implemented. A study of the literature is used to establish our formalism. Based on ontokogies, they structure the annotation object and adapt the Alexander design pattem to annotation action.",Faizal AZOUAOU and Cyrille Desmoulins and Dominique Mille,8,17948402277838426626,Artificial Intelligence in Education: Shaping the Future of Learning Through Intelligent Technologies,6389,374,IOS Press,Training Memory: Connecting Implicit and Explicit Semantics,http://books.google.com/books?hl=en&lr=&id=bTpLV0KLNTwC&oi=fnd&pg=PA374&dq=info:AhJf6MaIFfkJ:scholar.google.com&ots=-jzthw4HOh&sig=8e8_YL-drmaqXes7F00TXAXzG4A,922,2003,/scholar?cites=17948402277838426626,IaLjS0kAAAAJ:_kc_bZDykSQC
1025024,"During the last ten years, the interest of Arabic dialects treatment has greatly increased. This increase is mainly attributed to the large use of these dialects in social media. The works on Arabic dialects can be classified into four categories: basic analysis, resource construction, identification of Arabic dialects and semantic analysis on Arabic dialects. In this paper, we address the problem of Arabic lexicon construction. More specifically, we focus on Algerian dialect which is spoken by more than 40 million people. Our approach consists of three distinct steps: 1) Constructing a dialect lexicon and extracting the most intense words from a sentiment lexicon; 2) Merging two lexicons (a dialect and a sentiment lexicon) and replacing some letters with the most used letters in social media; 3) Enriching a lexicon that takes into account spelling variations of words specific to a social media domain. As a result, we ended up expanding the original lexicon of 1144 words to a new lexicon 25086 words.",Imane GUELLIL and Faical AZOUAOU,7,16448197532873386004,,,,,Bilingual Lexicon for Algerian Arabic Dialect Treatment in Social Media,http://www.winlp.org/wp-content/uploads/2017/final_papers_2017/92_Paper.pdf,,2017,/scholar?cites=16448197532873386004,IaLjS0kAAAAJ:ALROH1vI_8AC
1025025,"This paper presents a novel background knowledge approach which selects and combines existing mappings from a given biomedical ontology repository to improve ontology alignment. Current background knowledge approaches usually select either manually or automatically a limited number of different ontologies and use them as a whole for background knowledge. Whereas in our approach, we propose to pick up only relevant concepts and relevant existing mappings linking these concepts all together in a specific and customized background knowledge graph. Paths within this graph will help to discover new mappings. We have implemented and evaluated our approach using the content of the NCBO BioPortal repository and the Anatomy benchmark from the Ontology Alignment Evaluation Initiative. We used the mapping gain measure to assess how much our final background knowledge graph …",Amina Annane and Zohra Bellahsene and Faiçal Azouaou and Clement Jonquet,7,5404537395112143920,,,19-33,"Springer, Cham",Selection and combination of heterogeneous mappings to enhance biomedical ontology matching,https://link.springer.com/chapter/10.1007/978-3-319-49004-5_2,,2016,/scholar?cites=5404537395112143920,IaLjS0kAAAAJ:4xDN1ZYqzskC
1025026,"Even if multilingual ontologies are now more common, for historical reasons, in the biomedical domain, many ontologies or terminologies have been translated from one natural language to another resulting in two potentially aligned ontologies but with their own specificity (eg, format, developers, and versions). Most often, there is no formal representation of the translation links between translated ontologies and original ones and those mappings are not formally available as linked data. However, these mappings are very important for the interoperability and the integration of multilingual biomedical data. In this paper, we propose an approach to represent translation mappings between ontologies based on the NCBO BioPortal format. We have reconciled more than 228K mappings between ten English ontologies hosted on NCBO BioPortal and their French translations. Then, we have stored both the translated …",Amina Annane and Vincent Emonet and Faiçal Azouaou and Clement Jonquet,7,2995194990223576491,,,1-12,,Multilingual mapping reconciliation between english-french biomedical ontologies,https://dl.acm.org/doi/abs/10.1145/2912845.2912847,,2016,/scholar?cites=2995194990223576491,IaLjS0kAAAAJ:0CzhzZyukY4C
1025027,"To determine whether a document or a sentence expresses a positive or negative sentiment, three main approaches are commonly used: the lexicon-based approach, corpus-based approach, and a hybrid approach. The study of sentiment analysis in English has the highest number of sentiment analysis studies, while research is more limited for other languages, including Arabic and its dialects. Lexicon based approaches need annotated sentiment lexicons (containing the valence and intensity of its terms and expressions). Corpus-based sentiment analysis requires annotated sentences. One of the significant problems related to the treatment of Arabic and its dialects is the lack of these resources. We present in this survey the most recent resources and advances that have been done for Arabic sentiment analysis. This survey presents recent work (where the majority of these works are between 2015 and …",Imane Guellil and Faical Azouaou and Marcelo Mendoza,6,15866281747650413713,,1,56,Springer Vienna,"Arabic sentiment analysis: studies, resources, and tools",https://link.springer.com/article/10.1007/s13278-019-0602-x,9,2019,/scholar?cites=15866281747650413713,IaLjS0kAAAAJ:wKETBy42zhYC
1025028,"With Massive Open Online Courses (MOOCs) proliferation, online learners are exposed to various challenges. Therefore, the lack of personalized recommendation of MOOCs can drive learners to choose irrelevant MOOCs and then lose their motivation and surrender the learning process. Recommender System (RS) plays an important role in assisting learners to find appropriate MOOCs to improve learners’ engagements and their satisfaction/completion rates. In this paper, we propose a MOOCs recommender system combining memory-based Collaborative Filtering (CF) techniques and ontology to recommend personalized MOOCs to online learners. In our recommendation approach, Ontology is used to provide a semantic description of learner and MOOC which will be incorporated into the recommendation process to improve the personalization of learner recommendations whereas CF computes predictions and generates recommendation. Furthermore, our hybrid approach can relieve the cold-start problem by making use of ontological knowledge before the initial data to work on are available in the recommender system.",Kahina Rabahallah and Mahdaoui Latifa and Faical Azouaou,6,13497443899876101398,,,194,,MOOCs Recommender System using Ontology and Memory-based Collaborative Filtering,https://www.researchgate.net/profile/Faical_Azouaou/publication/324047229_MOOCs_Recommender_System_using_Ontology_and_Memory-based_Collaborative_Filtering/links/5cc34c98a6fdcc1d49b21939/MOOCs-Recommender-System-using-Ontology-and-Memory-based-Collaborative-Filtering.pdf,,2018,/scholar?cites=13497443899876101398,IaLjS0kAAAAJ:U4n9YNQMCAIC
1025029,"Recently, a lot of research focuses on knowledge management and reuse. Pertinent reuse can facilitate learning, knowledge creation and sharing. In this research, we focus on the knowledge capitalization and reuse within Communities of Practice of E-learning (CoPEs). These communities are a virtual framework for exchanging and sharing techno-pedagogical knowledge and know-how between e-learning actors. In this chapter, we propose and discuss a knowledge capitalization approach for knowledge reuse within a CoPE. Our approach is based on contextual semantic annotations to model CoPEs members’ tacit and explicit knowledge. The context dimension represents the situation in which the members create or reuse annotations. To illustrate our approach, we have developed a prototype of knowledge capitalization system based on contextual semantic annotations, called CoPEAnnot. Ontological …",Souâad Boudebza and Lamia Berkani and Faiçal Azouaou and Omar Nouali,6,7767699719592528557,,,95-115,"Springer, Cham",Using an ontological and Rule-based approach for contextual semantic annotations in online comMunities,https://link.springer.com/chapter/10.1007/978-3-319-05825-2_8,,2015,/scholar?cites=7767699719592528557,IaLjS0kAAAAJ:2tRrZ1ZAMYUC
1025030,"La plupart des outils d'analyse de sentiments traitent essentiellement l'arabe standard moderne (ASM), et peu d'entre eux ne prennent en considération les dialectes. À notre connaissance, aucun outil en libre accès n'est disponible concernant l'analyse de sentiments de textes écrits en dialecte algérien. Cet article présente un outil d'analyse de sentiments des messages écrits en dialecte algérien. Cet outil est fondé sur une approche combinant l'utilisation de lexiques ainsi qu'un traitement spécifique de l'agglutination. Nous avons évalué notre approche en utilisant deux lexiques annotés en sentiments et un corpus de test contenant 749 messages. Les résultats obtenus sont encourageants et montrent une amélioration continue après l'exécution de chaque étape de notre approche.",Imane Guellil and Faical Azouaou and Houda Saâdane and Nasredine Semmar,5,13903514424959244945,,,,,Une approche fondée sur les lexiques d'analyse de sentiments du dialecte algérien,https://hal.archives-ouvertes.fr/hal-02012130/,,2017,/scholar?cites=13903514424959244945,IaLjS0kAAAAJ:nRpfm8aw39MC
1025031,"Arabic is the official language spoken by 350 million people living in 22 countries in the world. However, this language is in state of diglossia where it lives with many dialects. A lot of research works have been done on the treatment of Arabic dialects. The Arabic Dialects are considered as under-resourced languages. Hence, many works are orientated to the resources construction (So construction of lexicon and corpora).Algerian Dialect is a Maghrebi Dialect spoken by over 40 million people. This dialect is rich and complex. It contains Arabic words, French words, Turkish words,… etc. However, it has only few works that treated it. Concerning resources construction, we got only one parallel corpus, one monolingual corpus and one lexicon between this dialect and Modern Standard Arabic (MSA). However this lexicon is not a freely resource, so we could not exploit it.",Faical AZOUAOU and Imane GUELLIL,5,4195679540004728082,,,,,ALG/FR: A step by step construction of a lexicon between Algerian Dialect and French,https://www.researchgate.net/profile/Imane_Guellil/publication/321670354_ALGFR_A_step_by_step_construction_of_a_lexicon_between_Algerian_Dialect_and_French/links/5a2a4fd7a6fdccfbbf81c2b7/ALG-FR-A-step-by-step-construction-of-a-lexicon-between-Algerian-Dialect-and-French.pdf,,2017,/scholar?cites=4195679540004728082,IaLjS0kAAAAJ:43bX7VzcjpAC
1025032,"In this paper, we describe our participation in the INEX 2015 Social Book Search Suggestion Track (SBS). We have exploited in our experiments only the tags assigned by users to books provided from LibraryThing (LT). We have investigated the impact of the weight of each term of the topic in the retrieval model using two methods. In the first method, we have used the TF-IQF formula to assign a weight to each term of the topic. In the second method, we have used Rocchio algorithm to expand the query and calculate the weight of the tags assigned to the example books mentioned in the book search request. Parameters of our models have been tuned using the topics of INEX 2014 and tested on INEX 2015 Social Book Search track.",Messaoud Chaa and Omar Nouali and Youcef Djenouri and Ahcène Bendjoudi and Djamel Djenouri,5,6646912437190704447,,,,,CERIST at INEX 2015: Social Book Search Track.,http://ceur-ws.org/Vol-1391/18-CR.pdf,,2015,/scholar?cites=6646912437190704447,IaLjS0kAAAAJ:sJsF-0ZLhtgC
1025033,"Annotating pedagogical documents is a common habit among learners, thus, considering learners’ annotation activity in education system and especially in technology enhanced learning can have many benefits for learners. However, the annotation practice by oneself is not sufficient in helping a learner to work and better understand his pedagogic documents. So we propose, in this paper, an annotation-based pedagogical process called SQAR (Survey, Question, Annotation and Review) which aims to help the learner to enhance his learning activity and to make sure his learning evolution in both knowledge and ability. We use the annotation activity, within the context of our proposed SQAR process, to enhance the learner’s learning efficiency. The SQAR process is implemented into WebAnnot, a web–based annotation tool. This is because learners use increasingly web-based pedagogical documents …",Belkacem Mostefai and Faiçal Azouaou and Amar Balla,5,6933896109248051877,,,17-33,"Springer, New York, NY",SQAR: an annotation-based study process to enhance the learner’s personal learning,https://link.springer.com/chapter/10.1007/978-1-4614-1539-8_2,,2012,/scholar?cites=6933896109248051877,IaLjS0kAAAAJ:MXK_kJrjxJIC
1025034,"To determine whether a document or a sentence expresses a positive or negative sentiment, three main approach types are commonly used: lexicon based approaches, machine learning (ML) based approaches and hybrid approaches. English has the greatest number of sentiment analysis studies, unlike other languages including Arabic and its dialects. More specifically, ML based sentiment analysis requires annotated data. In the case of lexicon based approaches, they typically require the availability of lexicons annotated by valence and/or intensity. One of the majors problems related to the treatment of Arabic and its dialect is the lack of the above resources. This survey is aimed to highlight the most recent resources that have been constructed and most recent advances in the context of sentiment analysis (related to English and Arabic language). It refers to about one hundred recent papers, most of which …",Imane Guellil and Faical Azouaou and Alessandro Valitutti,4,16570017911856500833,,,1-8,IEEE,"English vs Arabic Sentiment Analysis: A Survey Presenting 100 Work Studies, Resources and Tools",https://ieeexplore.ieee.org/abstract/document/9035299/,,2019,/scholar?cites=16570017911856500833,IaLjS0kAAAAJ:jU7OWUQzBzMC
1025035,"The YAM-BIO ontology alignment system is an extension of YAM++ but dedicated to aligning biomedical ontologies. YAM++ has successfully participated in several editions of the Ontology Alignment Evaluation Initiative (OAEI) between 2011 and 2013, but this is the first participation of YAM-BIO. The biomedical extension includes a new component that uses existing mappings between multiple biomedi-cal ontologies as background knowledge. In this short system paper, we present YAM-BIO's workflow and the results obtained in the Anatomy and Large Biomedical Ontologies tracks of the OAEI 2017 campaign. 1 Presentation of the YAM-BIO system 1.1 State, purpose, general statement YAM-BIO may be seen as an extension of YAM++ [5] that uses existing map-pings between multiple biomedical ontologies as background knowledge to enhance the matching results. The latest version of YAM++, which we reused in YAM-BIO, obtained excellent results in multiple Ontology Alignment Evaluation Initiative (OAEI) campaigns, especially in 2013 [11]. YAM++ did not participate more since then. Four years on from the last participation, our objective this year was to establish a comparison between the potential performance of a bio-customized YAM++, and state-of-the-art systems in matching biomedical ontologies. Over last OAEI campaigns, state-of-the-art systems such as AML [7] and LogMapBio [9] used specialized background knowledge to improve their results. More generally, the use of background knowledge –or indirect matching techniques– as recently allowed to obtain better results. YAM-BIO is an equivalent evolution of YAM++ in which we …",Amina Annane and Zohra Bellahsene and Faiçal Azouaou and Clement Jonquet,4,17331151206023507804,,,,,YAM-BIO–Results for OAEI 2017,https://hal-lirmm.ccsd.cnrs.fr/lirmm-01679503/,,2017,/scholar?cites=17331151206023507804,IaLjS0kAAAAJ:ubry08Y2EpUC
1025036,"The creation of the e-learning web services are increasingly growing. Therefore, their discovery is a very important challenge. The choice of the e-learning web services depend, generally, on the pedagogic, the financial and the technological constraints. The Learning Quality ontology extends existing ontology such as OWL-S to provide a semantically rich description of these constraints. However, due to the diversity of web services customers, other parameters must be considered during the discovery process, such as their preferences. For this purpose, the user profile takes into account to increase the degree of relevance of discovery results. We also present a modeling scenario to illustrate how our ontology can be used.",Kahina Rabahallah and Faiçal Azouaou and Mohamed Tayeb Laskri,4,12452281930266320612,,,117-124,IEEE,Ontology-Based Approach for semantic description and the discovery of e-learning web services,https://ieeexplore.ieee.org/abstract/document/7695159/,,2016,/scholar?cites=12452281930266320612,IaLjS0kAAAAJ:uDGL6kOW6j0C
1025037,"This article describes a conceptual model and a global architecture for a context-aware annotation based-memory. This memory aims to help the teacher to create and manage semantic annotations on his pedagogical documents, during the teaching process. This digital annotation-based memory is context-aware in order to offer the teacher an improved usability and to minimize his annotation efforts (effortless). The annotation conceptual model is composed of three parts (facets): cognitive, semantic and context. In order to facilitate the integration of the annotation tool with other teaching tools, the memory architecture is based on several web-services which communicate using XML messages.",A Ouadah and Faiçal Azouaou and Cyrille Desmoulins,4,11761618885583877067,IADIS Int. Conf. e-Learning,,215-223,,Models and Architecture for a teacher’s context-aware annotation memory,https://www.academia.edu/download/50281261/MODELS_AND_ARCHITECTURE_FOR_A_TEACHERS_20161113-25303-qizytq.pdf,,2009,/scholar?cites=11761618885583877067,IaLjS0kAAAAJ:4DMP91E08xMC
1025038,"Many people are exposed daily to different forms of terrorist threats on social networks, which make the control and detection of these contents paramount. We propose in this article, a system of detection of publications related to terrorism in the social network Twitter based on SVM (Simple Vector Machine). We established a 12-step process for analyzing, processing, and then detecting threatening tweets. We have developed 2 scenarios of use of this process, in the first scenario, we apply learning on 4000 tweets written in English, then 4000 tweets written in Arabic and finally 4000 tweets written in bilingual (in both languages). In the 2nd scenario, we apply learning on all the tweets at once (12000 tweets). These two scenarios allow us to compare the results obtained using SVM with results obtained using a syntactical approach.",Khaled Bedjou and Faiçal Azouaou and Abdelouhab Aloui,3,6773666616344144667,,,1-5,,Detection of terrorist threats on Twitter using SVM,https://dl.acm.org/doi/abs/10.1145/3341325.3342011,,2019,/scholar?cites=6773666616344144667,IaLjS0kAAAAJ:7H_MAutzIkAC
1025039,"De nos jours, les ontologies sont souvent développées de manière multilingue. Cependant, pour des raisons historiques, dans le domaine biomédical, de nombreuses ontologies ou terminologies ont été traduites d'une langue à une autre ou sont maintenues explicitement dans chaque langue. Cela génère deux ontologies potentiellement alignées mais avec leurs propres spécificités (format, développeurs, versions, etc.). Souvent, il n'existe pas de représentation formelle des liens de traduction reliant les ontologies traduites aux originales et ils ne sont pas accessibles sous forme de linked data. Cependant, ces liens sont très importants pour l'interopérabilité et l'intégration de données biomédicales multilingues. Dans cet article, nous présentons les résultats d'une étude de réconciliation des liens de traduction entre ontologies sous forme d'alignements multilingues. Nous avons réconcilié et représenté à l'aide de vocabulaire du web sémantique, plus de 228K mappings entre dix ontologies anglaises hébergées sur le NCBO BioPortal et leurs traductions françaises. Ensuite, nous avons stocké à la fois les ontologies et les mappings sur une version française de la plate-forme, appelée SIFR BioPortal, pour rendre le tout disponible en RDF (données liées). La réconciliation des alignements s'est avérée plus complexe que ce qu'on pourrait penser car les traductions ne sont que rarement l'exacte copie des originales comme nous le discutons. Mots-clés : Mappings ou alignements multilingues, réconciliations de mappings, web sémantique, données liées, alignement d'ontologies, entrepôt d'ontologies, ontologies biomédicales, BioPortal …",Amina Annane and Vincent Emonet and Faiçal Azouaou and Clement Jonquet,3,16237550944285190112,,,,,Réconciliation d'alignements multilingues dans BioPortal,https://hal-lirmm.ccsd.cnrs.fr/lirmm-01395900/,,2016,/scholar?cites=16237550944285190112,IaLjS0kAAAAJ:PVgj2kMGcgYC
1025040,"This article aims to present ESITrace, an e-learning-dedicated trace collector. ESITrace collects different kinds of traces produced by the learner while doing his learning activities, in the context of a Web based learning environment. This tool is a keylogger that collects two kinds of traces: involuntary ones, called simply “traces” and annotations which are added by the learner on his learning material to memorize his ideas. We follow a learner-side approach to track the entire learner’s activities, even those made outside the e-learning system. These traces enable the teacher to be aware about the learner’s activities and progression, and can be used by the learning management system to adapt the learning material to the learner behavior.",Abdelmoumene Louifi and Nabila Bousbia and Faiçal Azouaou and Fodil Merzoug,3,12603193767871700403,,,49-58,"Springer, Berlin, Heidelberg",ESITrace: a user side trace and annotation collection tool,https://link.springer.com/chapter/10.1007/978-3-662-43454-3_6,,2012,/scholar?cites=12603193767871700403,IaLjS0kAAAAJ:BJbdYPG6LGMC
1025041,"Cet article décrit un modèle conceptuel et une architecture globale pour une mémoire d’annotation context-aware. Cette mémoire permet à l’enseignant de gérer les annotations qu’il créées sur ses documents pédagogiques et adapte son comportement aux différents contextes de l’activité de cet enseignant, lui offrant ainsi une grande utilisabilité tout en minimisant son effort (effortless). Le modèle de l’annotation que nous proposons est composé de trois facettes: cognitive, sémantique et contextuelle. L’architecture globale de notre mémoire d’annotation est présentée comme un ensemble de modules à base de services web, et cela pour faciliter son intégration avec les autres outils utilisés par l’enseignant comme par exemple les plateformes eLearning. La communication entre les différents modules est concrétisée par des messages XML.",Abdelaziz Ouadah and Faiçal Azouaou and Cyrille Desmoulins,3,13152113629399490310,,,,,Modèles et Architecture d'une Mémoire d'Annotation context-aware pour l'Enseignant.,https://www.researchgate.net/profile/Abdelaziz_Ouadah/publication/221551593_Modeles_et_Architecture_d'une_Memoire_d'Annotation_context-aware_pour_l'Enseignant/links/0c96052555f44903f4000000/Modeles-et-Architecture-dune-Memoire-dAnnotation-context-aware-pour-lEnseignant.pdf,,2009,/scholar?cites=13152113629399490310,IaLjS0kAAAAJ:kNdYIx-mwKoC
