id,abstract,author,cites,cites_id,journal,number,pages,publisher,title,url,volume,year,citation_link,id_citations1019347,"Despite the diversity of the Earth's terrestrial ecosystems in structure and function, all obey similar biophysical and meteorological principles in their exchange of carbon dioxide, water, and energy with the overlying atmosphere. This conclusion was drawn from new data presented by Earth, atmospheric,and ecological scientists attending a recent workshop on the global flux network (FLUXNET) project.The FLUXNET project, funded by the National Aeronautics and Space Administration, consolidates existing regional networks of research sites around the world that measure fluxes of carbon dioxide, water vapor, and energy between terrestrial ecosystems and the atmosphere.These sites directly measure net ecosystem exchange (NEE) using a micro‐meteorological technique known as the eddy covariance method. The information collected is used to generate and validate algorithms that will be used by the Earth …",Lianhong Gu and Dennis Baldocchi and Nancy Kiang,4,3574097648539578895,"Eos, Transactions American Geophysical Union",47,565-570,,FLUXNET Evaluates “Breathing patterns” of diverse ecosystems,https://agupubs.onlinelibrary.wiley.com/doi/abs/10.1029/EO081i047p00565,81,2000,/scholar?cites=3574097648539578895,dJ8MMFoAAAAJ:BUYA1_V_uYcC
1019348,"Until recently, European regulatory agencies and photochemical modelers had to use biogenic hydrocarbon emission models that were based almost entirely on the results of investigations in North America. Field studies of biogenic hydrocarbon emissions have been conducted in North America and Europe for more than two decades but it is only recently that there has been an attempt at multidisciplinary (plant physiologists, micrometeorologists, atmospheric scientists, landscape ecologists) field studies. Whereas past studies involved a few scientists with similar backgrounds, recent studies have been much more multi-disciplinary efforts involving more scientists. In North America, investigations of biogenic hydrocarbon emissions have been important, but relatively minor, components of regional studies such as the Southern Oxidant Study in the United States and the BOREAS experiment in Canada. None of …",Thomas D Sharkey and Francesco Loreto and Dennis Baldocchi and Alex Guenther,4,3266822611380937701,Atmospheric Environment,,251-255,Pergamon,The BEMA-project—A North American perspective,https://www.sciencedirect.com/science/article/pii/S1352231097002665,31,1997,/scholar?cites=3266822611380937701,dJ8MMFoAAAAJ:9c2xU6iGI7YC
1019349,"Fluxes of carbon dioxide were measured above and below a boreal jack pine stand with the eddy covariance method. Our goal was to examine the seasonal variation of the net carbon dioxide exchange between the ecosystem and the atmosphere and to understand the relative contributions of the vegetation and rhizosphere to these fluxes. Over the course of the growing season the jack pine stand was a small, net sink of carbon dioxide—47 g С m~ 2 were assimilated during a 115 day period between spring (day 144) and autumn (day 259). On a daily basis, the magnitude of the net uptake of C02 by the forest was relatively small, less than 4 g Cm-2 day"" 1. We also observed many days when carbon dioxide was lost from the forest stand (up to 2 g С m 2 day~'). Day to day sums of net carbon dioxide exchange exhibited little seasonality, despite the seasonality experienced by controlling environmental and …",DD Baldocchi and Christoph A Vogel and B Hall,4,1565468539038159755,CONFERENCE ON AGRICULTURAL AND FOREST METEOROLOGY WITH SYMPOSIUM ON FIRE AND FOREST METEOROLOGY,,56-58,,Seasonal Variation of Carbon Dioxide Exchange Rates Above and Below a Boreal Jackpine Forest,http://nature.berkeley.edu/biometlab/pdf/ddb%20agformet%201997%2083.pdf,22,1996,/scholar?cites=1565468539038159755,dJ8MMFoAAAAJ:ipzZ9siozwsC
1019350,"The deposition velocities of hydrogen peroxide and organic peroxides were measured above a deciduous forest near Oak Ridge, Tennessee by the flux-gradient technique during the late summers of 1992 and 1993. Peroxide concentration gradients were determined with a single peroxide analyzer by sequentially sampling ambient air at two heights above the canopy. Concentration gradients were most pronounced during the late evening and early morning, and difficult to detect during the day amidst turbulent concentration fluctuations. A diurnal trend was observed with highest deposition velocities during the day. The average deposition velocities were 6.4±1.3 and 3.3±1.3 cm s51 during the day and 0.5±0.2 and 0.3±0.2 cm s 1 at night for H, O, and organic peroxides respectively. The dry deposition of H, O, in a deciduous forest appears to be similar to that of HNOj, which is believed to have a near-zero surface resistance. A non-zero surface resistance is suspected for organic peroxides. These results need further verification using shorter sampling times, or a non-sequential sampling technique.",Brad D Hall and Candis S Claiborn and Heidi Howard and Dennis D Baldocchi,4,10637291169304743097,TRANSACTIONS-AIR AND WASTE MANAGEMENT ASSOCIATION TR,,93-107,VAN NOSTRAND REINHOLD,Deposition of Gas Phase Peroxides: Measurements in a Deciduous Forest (OT4-I. 3),http://scholar.google.com/scholar?cluster=10637291169304743097&hl=en&oi=scholarr,24,1995,/scholar?cites=10637291169304743097,dJ8MMFoAAAAJ:lmc2jWPfTJgC
1019351,"The temperate region is highly populated, with most ecosystems in the region subject to at least some human influence. Large areas of forest and grassland, for ex ample, have been converted to agriculture, and many systems are receiving increased inputs of sulfur and nitrogen compounds associated with acid rain and in dustrial activity. These changes have the potential for having major effects on trace gas production and con sumption within the region.Although there have been many trace gas studies in the midlatitudes, only a few flux estimates, however, have been based on frequent measurements made over an entire year: most studies have been mechanistic in nature and have focused on small areas (eg, individual fields). Consequently, the effects on trace gas fluxes of converting native to agricultural lands, and of loading ecosystems with nutrients (N and S) and potential toxins are just beginning to be …",J Schimel and GP Robertson and D Baldocchi and J Bogner and E Davidson and J Duyzer and D Ehhalt and D Fowler and P Groffman and K Haider and V Isadorov and L Klemedtsson and J Melillo and K Smith and WH Su and W Wieprecht and VA Isodorov,4,8335846722228222823,Ecological Bulletins,42,124-132,Oikos Editorial Office,Impacts of trace gas fluxes in mid-latitude ecosystems,https://www.jstor.org/stable/20113113,,1992,/scholar?cites=8335846722228222823,dJ8MMFoAAAAJ:SpbeaW3--B0C
1019352,,D Baldocchi and B Hutchison and D Matt and R McMillen,4,12275214832831921151,,,,The Society,The effect of clumped foliage on the radiation regime in a deciduous forest canopy,http://agris.fao.org/agris-search/search.do?recordID=US874855188,,1985,/scholar?cites=12275214832831921151,dJ8MMFoAAAAJ:g3aElNc5_aQC
1019353,"The carbon exchange rate of alfalfa was found to be dependent on net radiation and turbulent mixing. However, the effect that turbu-lent mixing had cn the carbon exchange rate was greatly diminished during the mid-summer since the crop seemed to be limited to a greater degree by physiological factors.The diurnal pattern of the carbon water flux ratio (CWFR) was strongly dependent on net radiation and sensible heat advection. CFR was found to be linearly related to net radiation under non-advective conditions. When sensible heat was advected into the region, CWFR became insensitive to changes in net radiation. Results of a carbon balance indicate that, late in the growing season, a large proportion of photosynthate is translocated to the",Dennis D Baldocchi,4,11634470652072075240,,,,,Environmental and physiological effects on the carbon exchange rate and water use efficiency of alfalfa,https://digitalcommons.unl.edu/cgi/viewcontent.cgi?article=1171&context=natresdiss,,1979,/scholar?cites=11634470652072075240,dJ8MMFoAAAAJ:hMsQuOkrut0C
1019354,"In the first half of the twentieth century the measurement of rates of exchange of momentum, heat, and especially water between the terrestrial surface and the atmosphere was an elusive challenge. A wide variety of methods evolved, ranging from reliance on drag plates, evaporation pans, and weighed lysimeters to a variety of methods based on measurement of vertical gradients in the air. None of these provided great confidence in the results. The promise of direct measurement by eddy covariance was held at bay by the lack of suitable fast-response instrumentation and the analytical requirement to average the products of pairs of these fast-response signals. Developments starting in the 1950s have now largely solved the problems that previously limited eddy covariance. Here, the history of flux measurement is summarized, and the path to now-standard capabilities is explored. The currently active major …",Bruce B Hicks and Dennis D Baldocchi,3,946892133242708661,Boundary-Layer Meteorology,,,,"Measurement of Fluxes Over Land: Capabilities, Origins, and Remaining Challenges.",https://link.springer.com/content/pdf/10.1007/s10546-020-00531-y.pdf,177,2020,/scholar?cites=946892133242708661,dJ8MMFoAAAAJ:zmJoL7Ye8dcC
1019355,,G Yu and Z Chen and L Zhang and C Peng and J Chen and S Piao and Y Zhang and S Niu and Q Wang and Y Luo,3,3997426300988131986,J. Resour. Ecol,,115-120,,Recognizing the scientific mission of flux tower observation networks—Laying a solid scientific data foundation for solving ecological issues related to global change,http://scholar.google.com/scholar?cluster=3997426300988131986&hl=en&oi=scholarr,8,2017,/scholar?cites=3997426300988131986,dJ8MMFoAAAAJ:iMbXGt5dmAEC
1019356,This is the FLUXNET2015 version of the carbon flux data for the site US-Var Vaira Ranch-Ione.,Dennis Baldocchi,3,12931066421414246331,,,,"FluxNet; Univ. of California, Berkeley, CA (United States)",FLUXNET2015 US-Var Vaira Ranch-Ione,https://www.osti.gov/biblio/1440094,,2016,/scholar?cites=12931066421414246331,dJ8MMFoAAAAJ:gKLIUvgTho8C
1019357,This is the FLUXNET2015 version of the carbon flux data for the site US-Ton Tonzi Ranch.,Dennis Baldocchi,3,10178083244945300982,,,,"FluxNet; Univ. of California, Berkeley, CA (United States)",FLUXNET2015 US-Ton Tonzi Ranch,https://www.osti.gov/biblio/1440092,,2016,/scholar?cites=10178083244945300982,dJ8MMFoAAAAJ:l04XxKJJ8swC
1019358,This is the FLUXNET2015 version of the carbon flux data for the site US-Tw4 Twitchell East End Wetland.,Dennis Baldocchi,3,8998319688635087097,,,,"FluxNet; Univ. of California, Berkeley, CA (United States)",FLUXNET2015 US-Tw4 Twitchell East End Wetland,https://www.osti.gov/biblio/1440111,,2016,/scholar?cites=8998319688635087097,dJ8MMFoAAAAJ:gD_FYv0mKhcC
1019359,"This is the AmeriFlux version of the carbon flux data for the site US-Tw3 Twitchell Alfalfa. Site Description-The Twitchell Alfalfa site is an alfalfa field owned by the state of California and leased to third parties for farming. The tower was installed on May 24, 2013. This site and the surrounding region are part of the San Joaquin-Sacramento River Delta drained beginning in the 1850's and subsequently used for agriculture. The field has been alfalfa for X years…., Crop rotation occurs every 5-6 years. The site is harvested by mowing and bailing several times per year. The field is fallow typically between November and February. The site is irrigated by periodically-flooded ditches surrounding the field. The site is irrigated by raising, and subsequently lowering the water table??",Dennis Baldocchi,3,7545147239412263627,,,,"AmeriFlux; Univ. of California, Berkeley, CA (United States)",AmeriFlux US-Tw3 Twitchell Alfalfa,https://www.osti.gov/biblio/1246149,,2016,/scholar?cites=7545147239412263627,dJ8MMFoAAAAJ:rLGzs9wiiwIC
1019360,"This is the AmeriFlux version of the carbon flux data for the site US-Var Vaira Ranch-Ione. Site Description-Located in the lower foothills of the Sierra Nevada Mountains on privately owned land, the Vaira Ranch site is classified as a grassland dominated by C3 annual grasses. Managed by local rancher, Fran Vaira, brush has been periodically removed for cattle grazing. Species include a variety of grasses and herbs, including purple false brome, smooth cat's ear, and rose clover. Growing season is confined to the wet season only, typically from October to early May.",Dennis Baldocchi,3,3423569404187556354,,,,"AmeriFlux; Univ. of California, Berkeley, CA (United States)",AmeriFlux US-Var Vaira Ranch-Ione,https://www.osti.gov/biblio/1245984,,2016,/scholar?cites=3423569404187556354,dJ8MMFoAAAAJ:3_LpOwP6eMYC
1019361,"Shifts in the timing of spring phenology are a central feature of global change research. Satellite remote sensing is used for continental to global monitoring. Although numerous methods exist to extract phenological timing, in particular start-of-spring (SOS), from time series of reflectance data, a comprehensive intercomparison and interpretation of SOS techniques has not been conducted. Here we assess 10 SOS techniques for North America between 1982 and 2006. The techniques include consistent inputs from the Global Inventory Modeling and Mapping Studies Advanced Very High Resolution Radiometer NDVIg dataset, independent data for snow cover, soil thaw, lake ice dynamics, spring streamflow timing, over 16,000 individual measurements of ground-based phenology, and two temperature-driven models of spring phenology. Compared to an ensemble of the 10 SOS methods, we found that individual …",M White and K de Beurs and K Didan and D Inouye and A Richardson and O Jensen and J O'Keefe and G Zhang and R Nemani and W van Leeuw and M Schwartz and J Brown and A de Wit and M Schaepman and D Baldocchi and X Lin and M Dettinger and A Bailey and J Kimball and J Lee and W Lauenroth,3,68525893028315837,AGUFM,,B54C-05,,"Intercomparison, interpretation, and assessment of spring phenology in North America estimated from remote sensing for 1982 to 2006",https://ui.adsabs.harvard.edu/abs/2008AGUFM.B54C..05W/abstract,2008,2008,/scholar?cites=68525893028315837,dJ8MMFoAAAAJ:b6LYR6tDxhYC
1019362,"The recently gathered FLUXNET synthesis dataset contains on the order of 900 site years from over 260 sites. The size of this dataset makes browsing of the data difficult for users without additional help. For instance, a search of the dataset for sites with particular meteorological or flux characteristics would require a download of the complete dataset and then running all of the data through a preliminary analysis. Instead we have developed a Scientific Data Server which enables browsing of the data on-line and then download of only the data needed for an analysis. The Scientific Data Server leverages modern database technology and stores the data in a database. This server allows individual researchers to concentrate on science rather than data management. We leverage database tools such as data cubes and web reports to enable Excel pivot table and browser access to the data. It is our belief that by using …",D Agarwal and D Baldocchi and T Boden and B Cook and D Frank and M Goode and J Gupchup and S Holladay and M Humphrey and C van Ingen and B Jackson and D Papale and M Reichstein and M Rodriguez and Y Ryu and R Vargas and B Wilson and N Li,3,9481203894981778539,AGUFM,,B33E-1657,,Creating and accessing the global fluxnet data set,https://ui.adsabs.harvard.edu/abs/2007AGUFM.B33E1657A/abstract,2007,2007,/scholar?cites=9481203894981778539,dJ8MMFoAAAAJ:b1wdh0AR-JQC
1019363,"Data sets of continuous CO2 flux measurements at 18 flux towers on nontropical grasslands in North America, Europe and Asia were analyzed to estimate the major parameters of CO2 exchange and light-use efficiency, evaluate carbon sequestration potential, and determine their role in regional and global carbon budget. Partitioning of the tower-derived net ecosystem CO2 exchange (Fc) data into gross primary productivity (Pg) and ecosystem respiration (Re) components (Fc= Pg'Re) was achieved using the physiologically-based analysis of ecosystem-scale light-response functions. Maximum daily rates of gross primary production and total ecosystem respiration achieved the 63 g CO2 m-2 d-1 and 54 g CO2 m-2 d-1 respectively and were recorded not only in high productive tallgrass prairies, but also in southern arid grasslands in years with exceptionally high precipitation. Maxima of annual gross primary production (GPP) of 5200 g CO2 m-2 yr-1 and total ecosystem respiration (RE) of 4700 g CO2 m-2 yr-1 were observed in tallgrass prairies of Oklahoma and Texas; the lowest GPP< 400 g CO2 m-2 yr-1 was recorded on the grazed mixed prairie in Montana during a drought year; the lowest RE< 500 g CO2 m-2 yr-1 was estimated for the semidesert grassland in the foothills of Uzbekistan. Depending on hydrothermal conditions and management (grazing, fire), annual net ecosystem CO2 exchange (NEE) of grasslands varies from 2800 g CO2 m-2 yr-1 (early postfire succession in tallgrass prairie, strong carbon sink) to NEE<'1500 g CO2 m-2 yr-1 (grazed mixed/tallgrrass prairie, Oklahoma during a drought year, a strong carbon source …",T Gilmanov and M Demment and B Wylie and E Laca and K Akshalov and D Baldocchi and L Belelli and James Bradford and R Coulter and W Dugas and William Emmerich and L Flanagan and A Frank and Marshall Haferkamp and Douglas Johnson and T Meyers and Jack Morgan and M Nasyrov,3,10783328283303829515,,,,,"QUANTIFICATION OF CO2 EXCHANGE IN GRASSLAND ECOSYSTEMS OF THE WORLD USING TOWER MEASUREMENTS, MODELING AND REMOTE SENSING 1653",https://www.ars.usda.gov/research/publications/publication/?seqNo115=169247,,2005,/scholar?cites=10783328283303829515,dJ8MMFoAAAAJ:SGW5VrABaM0C
1019364,"The exchanges of solar energy, carbon dioxide, water vapor and trace gases between a forest and the atmosphere are among the most fundamental processes to be quantified when studying the physiological and ecological functioning of a forest and the chemistry and climate of its overlying atmosphere. A forest must attain energy to sustain the work that is needed to assimilate carbon dioxide, for biosynthesis, to evaporate water, and to transport nutrients from the soil to the plant. Concurrently, these activities require flows of substrate material, which are obtained from the atmosphere and soil.",Dennis D Baldocchi and Kell Wilson,3,716427486375873828,,,229-242,"Springer, Dordrecht",Scaling up to the ecosystem level,https://link.springer.com/chapter/10.1007/978-94-015-9856-9_12,,2002,/scholar?cites=716427486375873828,dJ8MMFoAAAAJ:QsaTk4IG4EwC
1019365,,D Baldocchi and S Verma and N Rosenberg,3,9970419463448480338,Agronomy Abstracts,,,,"Effect of wind on canopy structure, irradiance penetration and source-sink locations: 72nd annual meeting American Society of Agronomy",http://scholar.google.com/scholar?cluster=9970419463448480338&hl=en&oi=scholarr,9,1980,/scholar?cites=9970419463448480338,dJ8MMFoAAAAJ:ILKRHgRFtOwC
1019366,"Globally, soils store two to three times as much carbon as currently resides in the atmosphere, and it is critical to understand how soil greenhouse gas (GHG) emissions and uptake will respond to ongoing climate change. In particular, the soil‐to‐atmosphere CO2 flux, commonly though imprecisely termed soil respiration (RS), is one of the largest carbon fluxes in the Earth system. An increasing number of high‐frequency RS measurements (typically, from an automated system with hourly sampling) have been made over the last two decades; an increasing number of methane measurements are being made with such systems as well. Such high frequency data are an invaluable resource for understanding GHG fluxes, but lack a central database or repository. Here we describe the lightweight, open‐source COSORE (COntinuous SOil REspiration) database and software, that focuses on automated, continuous and …",Ben Bond‐Lamberty and Danielle S Christianson and Avni Malhotra and Stephanie C Pennington and Debjani Sihi and Amir AghaKouchak and Hassan Anjileli and M Altaf Arain and Juan J Armesto and Samaneh Ashraf and Mioko Ataka and Dennis Baldocchi and Thomas Andrew Black and Nina Buchmann and Mariah S Carbone and Shih‐Chieh Chang and Patrick Crill and Peter S Curtis and Eric A Davidson and Ankur R Desai and John E Drake and Tarek S El‐Madany and Michael Gavazzi and Carolyn‐Monika Görres and Christopher M Gough and Michael Goulden and Jillian Gregg and Omar Gutiérrez del Arroyo and Jin‐Sheng He and Takashi Hirano and Anya Hopple and Holly Hughes and Järvi Järveoja and Rachhpal Jassal and Jinshi Jian and Haiming Kan and Jason Kaye and Yuji Kominami and Naishen Liang and David Lipson and Catriona A Macdonald and Kadmiel Maseyk and Kayla Mathes and Marguerite Mauritz and Melanie A Mayes and Steve McNulty and Guofang Miao and Mirco Migliavacca and Scott Miller and Chelcy F Miniat and Jennifer G Nietz and Mats B Nilsson and Asko Noormets and Hamidreza Norouzi and Christine S O’Connell and Bruce Osborne and Cecilio Oyonarte and Zhuo Pang and Matthias Peichl and Elise Pendall and Jorge F Perez‐Quezada and Claire L Phillips and Richard P Phillips and James W Raich and Alexandre A Renchon and Nadine K Ruehr and Enrique P Sánchez‐Cañete and Matthew Saunders and Kathleen E Savage and Marion Schrumpf and Russell L Scott and Ulli Seibt and Whendee L Silver and Wu Sun and Daphne Szutu and Kentaro Takagi and Masahiro Takagi and Munemasa Teramoto and Mark G Tjoelker and Susan Trumbore and Masahito Ueyama and Rodrigo Vargas and Ruth K Varner and Joseph Verfaillie and Christoph Vogel and Jinsong Wang and Greg Winston and Tana E Wood and Juying Wu and Thomas Wutzler and Jiye Zeng and Tianshan Zha and Quan Zhang and Junliang Zou,2,1650181457790952146,Global change biology,12,7268-7283,,COSORE: A community database for continuous soil respiration and other soil‐atmosphere greenhouse gas flux data,https://onlinelibrary.wiley.com/doi/abs/10.1111/gcb.15353,26,2020,/scholar?cites=1650181457790952146,dJ8MMFoAAAAJ:zSM0IxRRLoQC
1019367,"Rising atmospheric CO 2 concentration ([CO 2]) enhances photosynthesis and reduces transpiration at the leaf, ecosystem, and global scale via the CO 2 fertilization effect. The CO 2 fertilization effect is among the most important processes for predicting the terrestrial carbon budget and future climate, yet it has been elusive to quantify. For evaluating the CO 2 fertilization effect on land photosynthesis and transpiration, we developed a technique that isolated this effect from other confounding effects, such as changes in climate, using a noisy time series of observed land-atmosphere CO 2 and water vapor exchange. Here, we evaluate the magnitude of this effect from 2000 to 2014 globally based on constraint optimization of gross primary productivity (GPP) and evapotranspiration in a canopy photosynthesis model over 104 global eddy-covariance stations. We found a consistent increase of GPP (0.138±0.007% ppm …",Masahito Ueyama and Kazuhito Ichii and Hideki Kobayashi and Tomo’omi Kumagai and Jason Beringer and Lutz Merbold and Eugénie S Euskirchen and Takashi Hirano and Luca Belelli Marchesini and Dennis Baldocchi and Taku M Saitoh and Yasuko Mizoguchi and Keisuke Ono and Joon Kim and Andrej Varlagin and Minseok Kang and Takanori Shimizu and Yoshiko Kosugi and M Syndonia Bret-Harte and Takashi Machimura and Yojiro Matsuura and Takeshi Ohta and Kentaro Takagi and Satoru Takanashi and Yukio Yasuda,2,3521524760447627064,Environmental Research Letters,8,084009,IOP Publishing,Inferring CO2 fertilization effect based on global monitoring land-atmosphere exchange with a theoretical model,https://iopscience.iop.org/article/10.1088/1748-9326/ab79e5/meta,15,2020,/scholar?cites=3521524760447627064,dJ8MMFoAAAAJ:RcYKfjg9Zh4C
1019368,"There are few observational studies measuring the ecosystem‐scale productivity effects of changes in incident diffuse photosynthetically active radiation (PARdiffuse), especially related to wildfire smoke. Climate change‐induced increases to the duration and intensity of fire conditions have made smoke a common occurrence across western North America, with largely unquantified ecosystem feedbacks. Under equivalent amounts of radiation, increased atmospheric particulate matter could lead to a boost in productivity as scattering redistributes photons throughout multilayer canopies. In this work, we leverage a meso‐network of eddy covariance measurement sites across a unique array of managed and restored C3 and C4 canopy types to understand how recent wildfire smoke affected ecosystem productivity during the summer of 2018, an especially smoky year in the agriculturally productive Central Valley. We …",Kyle S Hemes and Joseph Verfaillie and Dennis D Baldocchi,2,1221129495056172105,Journal of Geophysical Research: Biogeosciences,2,e2019JG005380,,Wildfire‐Smoke Aerosols Lead to Increased Light Use Efficiency Among Agricultural and Restored Wetland Land Uses in California's Central Valley,https://agupubs.onlinelibrary.wiley.com/doi/abs/10.1029/2019JG005380,125,2020,/scholar?cites=1221129495056172105,dJ8MMFoAAAAJ:lN037PIkXpQC
