id,abstract,author,cites,cites_id,journal,number,pages,publisher,title,url,volume,year,citation_link,id_citations
1025000,"Cet article a pour objet de présenter les formalismes définis pour des mémoires de formation à base d'annotations au sein du projet MICA. Il explicite les objectifs de la recherche et les exigences que cela apporte sur les outils visés. Une étude des travaux de la littérature sur les annotations et leurs formalismes montre qu'ils ne couvrent que de façon très limitée nos objectifs. Nous présentons alors les formalismes que nous avons développés, en structurant l'objet d'annotation et en le basant sur des ontologies, en formalisant les patrons d'Alexander, sur la même base d'ontologies. Enfin nous établissons dans quelle mesure les objectifs sont atteints par ces formalismes et nous présentons les expérimentations que nous allons mener pour les valider à partir d'une maquette d'un outil de mémoire de formation sur des e-book.",Faiçal Azouaou and Cyrille Desmoulins and Dominique Mille,35,3796282321140321960,,,,,Formalismes pour une mémoire de formation à base d'annotations,https://edutice.archives-ouvertes.fr/edutice-00000117/,,2003,/scholar?cites=3796282321140321960,IaLjS0kAAAAJ:u-x6o8ySG0sC
1025001,"Data annotation is an important but time-consuming and costly procedure. To sort a text into two classes, the very first thing we need is a good annotation guideline, establishing what is required to qualify for each class. In the literature, the difficulties associated with an appropriate data annotation has been underestimated. In this paper, we present a novel approach to automatically construct an annotated sentiment corpus for Algerian dialect (A Maghrebi Arabic dialect). The construction of this corpus is based on an Algerian sentiment lexicon that is also constructed automatically. The presented work deals with the two widely used scripts on Arabic social media: Arabic and Arabizi. The proposed approach automatically constructs a sentiment corpus containing 8000 messages (where 4000 are dedicated to Arabic and 4000 to Arabizi). The achieved F1-score is up to 72% and 78% for an Arabic and Arabizi …",Imane Guellil and Ahsan Adeel and Faical Azouaou and Amir Hussain,26,12228675314521091986,,,557-567,"Springer, Cham",Sentialg: Automated corpus annotation for algerian sentiment analysis,https://link.springer.com/chapter/10.1007/978-3-030-00563-4_54,,2018,/scholar?cites=12228675314521091986,IaLjS0kAAAAJ:7Hz3ACDFbsoC
1025002,"Machine transliteration is a very important research area in the field of machine translation. Neural Machine transliteration (NMTR) is a new approach to machine transliteration that has shown promising results. However research on NMTR of Arabic has just begun to give results while no research has been done on neural transliteration of Arabic dialect written in Latin letters known by “Arabizi”.In the current paper, we propose a method of applying a neural transliteration based on a character-level for transliterating the Arabizi to Arabic script. Our method is composed of two important steps: 1) An Arabizi corpus construction 2) A character-based neural transliteration of Arabizi to Arabic.",Imane Guellil and Faiçal Azouaou and Mourad Abbas and Sadat Fatiha,26,5496263175734173122,,,,,Arabizi transliteration of algerian arabic dialect into modern standard arabic,https://www.researchgate.net/profile/Imane_Guellil/publication/318755390_Arabizi_transliteration_of_Algerian_Arabic_dialect_into_Modern_Standard_Arabic/links/59e5f441aca272390ee016a0/Arabizi-transliteration-of-Algerian-Arabic-dialect-into-Modern-Standard-Arabic.pdf,,2017,/scholar?cites=5496263175734173122,IaLjS0kAAAAJ:WHdLCjDvYFkC
1025003,,Sadat Fatiha Imane Guellil and Faical Azouaou and Mourad Abbas,26,5496263175734173122,,,,,Arabizi transliteration of Algerian Arabic dialect into Modern Standard Arabic,,,2017,/scholar?cites=5496263175734173122,IaLjS0kAAAAJ:48xauSegjOkC
1025004,"In this paper, we propose a model of semantic annotations suitable for teachers. It is aimed at implementing a tool that provides teachers with a digital memory based on annotations, as a basis. The model adapts to teachers' activities with regard to both their pedagogical and domain expertise. We analyse the specifics of an annotation language that would enable teachers to express their own expertise. We first discuss requirements for teachers' annotations and then propose a conceptual model, complying with these requirements. By using ontologies to represent teachers' annotations semantics we have obtained a specialised teacher annotation model, which we have used to create an annotation tool called 'MemoNote'. We present implementation details of the MemoNote tool as well as the results of an evaluation study of the proposed model conducted with chemistry teachers.",Faical Azouaou and Cyrille Desmoulins,26,5249212882310578411,International Journal of Continuing Engineering Education and Life Long Learning,1-2,18-34,Inderscience Publishers,Teachers' document annotating: Models for a digital memory tool,https://www.inderscienceonline.com/doi/abs/10.1504/IJCEELL.2006.008915,16,2006,/scholar?cites=5249212882310578411,IaLjS0kAAAAJ:d1gkVwhDpl0C
1025005,"This paper aims at providing the specification for semantic annotation tools for e-learning. From the specific requirements of annotating learning material, we categorize and evaluate the existing annotation tools, mainly general purpose ones. We illustrate two research prototypes of annotation tools we developed, and evaluate to what extend the specific requirements of annotating learning material are reached by these research prototypes.",Faical Azouaou and Weiqin Chen and Cyrille Desmoulins,24,8211677750047637392,,,,,Semantic annotation for learning material,http://scholar.google.com/scholar?cluster=8211677750047637392&hl=en&oi=scholarr,,2004,/scholar?cites=8211677750047637392,IaLjS0kAAAAJ:u5HHmVD_uO8C
1025006,"This paper aims at providing the specification for semantic annotation tools for e-learning. From the specific requirements of annotating learning material, we categorize and evaluate the existing annotation tools, mainly general purpose ones. We illustrate two research prototypes of annotation tools we developed, and evaluate to what extend the specific requirements of annotating learning material are reached by these research prototypes. 1",Faiçal Azouaou and Weiqin Chen and Cyrille Desmoulins,23,15936385725941257987,,,,,Semantic annotation tools for learning material,http://citeseerx.ist.psu.edu/viewdoc/summary?doi=10.1.1.98.7162,,2004,/scholar?cites=15936385725941257987,IaLjS0kAAAAJ:LgRImbQfgY4C
1025007,"Arabic is recognised as the 4th most used language of the Internet. Arabic has three main varieties: (1) classical Arabic (CA), (2) Modern Standard Arabic (MSA), (3) Arabic Dialect (AD). MSA and AD could be written either in Arabic or in Roman script (Arabizi), which corresponds to Arabic written with Latin letters, numerals and punctuation. Due to the complexity of this language and the number of corresponding challenges for NLP, many surveys have been conducted, in order to synthesise the work done on Arabic. However these surveys principally focus on two varieties of Arabic (MSA and AD, written in Arabic letters only), they are slightly old (no such survey since 2015) and therefore do not cover recent resources and tools. To bridge the gap, we propose a survey focusing on 90 recent research papers (74% of which were published after 2015). Our study presents and classifies the work done on the three …",Imane Guellil and Houda Saâdane and Faical Azouaou and Billel Gueni and Damien Nouvel,22,10830463774136797589,Journal of King Saud University - Computer and Information Sciences,2,11,Elsevier,Arabic Natural Language Processing: an overview,https://www.sciencedirect.com/science/article/pii/S1319157818310553,31,2019,/scholar?cites=10830463774136797589,IaLjS0kAAAAJ:kw52XkFRtyQC
1025008,"This article aims to propose a model of semantic annotation dedicated to the teacher. This model must adapt to the teacher's activity specificity, who needs to master both a pedagogical and domain expertise. In this paper, we analyze the particularity of the teacher's annotation language that enables the teacher to express his own expertise. First, we identify the concepts of this annotation language used by the community of teachers. Then we propose a conceptual model of this language based on ontologies. We use these ontologies to propose an annotation model (MemoNote) in order to enable the teachers annotating using their own language. In order to check the validity of this model (ontologies and annotation language) in representing the teachers' semantics, we describe the results of an investigation done with chemistry teachers. Finally we specify the external and internal representations of the annotation tool for the implantation.",Faiçal Azouaou and Cyrille Desmoulins,22,16580951008664366955,,,,,Semantic annotation for the teacher: models for a computerized memory tool,http://scholar.google.com/scholar?cluster=16580951008664366955&hl=en&oi=scholarr,,2005,/scholar?cites=16580951008664366955,IaLjS0kAAAAJ:9yKSN-GCB0IC
1025009,"The identification of Arabic dialects is considered to be the first pre-processing component by any NLP problem. This identification is useful for automatic translation, information retrieval, opinion mining and sentiment analysis. Most of the work on the identification treat this issue like any classification problem. These work are based on supervised learning. The majority of them are based on the EGYPTIAN (EGY), the TUNISIAN (TUN), the IRAQI (IRAQI) dialect, etc., by omitting the Algerian dialect. The purpose of this paper is to identify the Arabic dialects within social media in an unsupervised manner. In order to do so, we use an Algerian dialect lexicon and based on Algeriers Dialect. We also propose an approach based on an algorithm that perform three kinds of identification: (1) total (when the term is totally identify), (2) partial (when the term is identified only partially with prefix and suffix) and by using the …",Imène Guellil and Faiçal Azouaou,21,5904274022363976916,,,724-731,IEEE,Arabic dialect identification with an unsupervised learning (based on a lexicon). application case: Algerian dialect,https://ieeexplore.ieee.org/abstract/document/7982330/,,2016,/scholar?cites=5904274022363976916,IaLjS0kAAAAJ:otzGkya1bYkC
1025010,"Designing ontologies that could be shared for developing ontology-based learning environments is still a challenge. The overall aim of the OURAL project was to provide a case study on common ontology design. It brought together researchers and practitioners from different domains (educational science, computer science, and cognitive psychology). We benefited from several on going field studies launched to identify authors and tutors needs and to prototype ontology-based services providing answers to the identified needs. In this paper, we describe the context of the project, the case studies that have been chosen, the focus on helping the teacher in describing ""learning situations "", the resulting ontology as well as the principles we used and some conclusions about ontology elicitation and reuse from these case studies.",Monique Grandbastien and Faiçal Azouaou and Cyrille Desmoulins and Richard Faerber and Dominique Leclet and Céline Quénu-Joiron,17,11846131555737497159,,,694-698,IEEE,Sharing an ontology in Education: Lessons learnt from the OURAL project,https://ieeexplore.ieee.org/abstract/document/4281129/,,2007,/scholar?cites=11846131555737497159,IaLjS0kAAAAJ:Tyk-4Ss8FVUC
1025011,"The objective of this article is to study and model the annotation context, to be used as a basis to design context- aware annotation functionalities dedicated to the teacher into the MemoNote tool. MemoNote tool is a semantic and personal annotation tool dedicated to teachers,. Starting from a specification of context and more precisely annotation context, we define how to capture it from elements of the teaching situation and to model it with ontologies. Annotation context can then be used by the two MemoNote annotation functionalities, manual annotation and pattern-based annotation.. It is done by selecting a set of ontologies and patterns suited for the current context.",Faiçal Azouaou and Cyrille Desmoulins,17,1621314484088892838,,,621-628,IEEE,"MemoNote, a context-aware annotation tool for teachers",https://ieeexplore.ieee.org/abstract/document/4141686/,,2006,/scholar?cites=1621314484088892838,IaLjS0kAAAAJ:IjCSPb-OGe4C
1025012,"This article aims at defining a context ontology of teacher’s personal annotation, in order to use it in a context-aware annotation tool “MemoNote”. Starting from a general definition of the context and its application to teacher’s annotation, we define the uses of active and passive contexts in MemoNote (annotation ontologies selection, annotation memorization, pattern definition and selection). We then develop completely teacher’s annotation context annotation ontology using the classical method specified for Protégé. Finally the current state of the tool development is sketched, in terms of context-aware functionalities.",Faiçal Azouaou and Cyrille Desmoulins,16,13487646267528457248,International Workshop on Applications of Semantic Web Technologies for E-Learning,,,,Using and modeling context with ontology in e-learning: the case of teacher’s personal annotation,https://www.academia.edu/download/34836325/Azouaou_Desmoulins_SWEL06.pdf,,2006,/scholar?cites=13487646267528457248,IaLjS0kAAAAJ:YOwf2qJgpHMC
1025013,"Ontology matching is critical for data integration and interoperability. Original ontology matching approaches relied solely on the content of the ontologies to align. However, these approaches are less effective when equivalent concepts have dissimilar labels and are structured with different modeling views. To overcome this semantic heterogeneity, the community has turned to the use of external background knowledge resources. Several methods have been proposed to select ontologies, other than the ones to align, as background knowledge to enhance a given ontology-matching task. However, these methods return a set of complete ontologies, while, in most cases, only fragments of the returned ontologies are effective for discovering new mappings. In this article, we propose an approach to select and build a background knowledge resource with just the right concepts chosen from a set of ontologies, which …",Amina Annane and Zohra Bellahsene and Faical Azouaou and Clement Jonquet,15,1598584552974997246,Journal of Web Semantics,,51-68,Elsevier,Building an effective and efficient background knowledge resource to enhance ontology matching,https://www.sciencedirect.com/science/article/pii/S1570826818300179,51,2018,/scholar?cites=1598584552974997246,IaLjS0kAAAAJ:cK4Rrx0J3m0C
1025014,"Community structure is one of the most prominent features of complex networks. Community structure detection is of great importance to provide insights into the network structure and functionalities. Most proposals focus on static networks. However, finding communities in a dynamic network is even more challenging, especially when communities overlap with each other. In this article, we present an online algorithm, called OLCPM, based on clique percolation and label propagation methods. OLCPM can detect overlapping communities and works on temporal networks with a fine granularity. By locally updating the community structure, OLCPM delivers significant improvement in running time compared with previous clique percolation techniques. The experimental results on both synthetic and real-world networks illustrate the effectiveness of the method.",Souâad Boudebza and Rémy Cazabet and Faiçal Azouaou and Omar Nouali,14,15576136413202192372,Computer Communications,,36-51,Elsevier,Olcpm: An online framework for detecting overlapping communities in dynamic social networks,https://www.sciencedirect.com/science/article/pii/S0140366417308149,123,2018,/scholar?cites=15576136413202192372,IaLjS0kAAAAJ:v1_lew4L6wgC
1025015,"In this paper, we propose a model of semantic annotation suitable for learners. It is used to implement a web annotation tool WebAnnot which enables the learners to annotate their pedagogical documents with graphical and semantic annotations. The annotation semantics is built using both generic and learning domain ontologies. WebAnnot provides two annotation functions: manual and pattern-based ones. WebAnnot is implemented as a Firefox add-on, using semantic web technologies and languages. We present the results of an evaluation study of the proposed model conducted with computer science undergraduate students, regarding their annotation experience using WebAnnot.",Faiçal Azouaou and Hakim Mokeddem and Lamia Berkani and Abdelaziz Ouadah and Belkacem Mostefai,14,17845927026039022236,International Journal of Technology Enhanced Learning,1,56-84,Inderscience Publishers Ltd,WebAnnot: a learner’s dedicated web-based annotation tool,https://www.inderscienceonline.com/doi/abs/10.1504/IJTEL.2013.055949,5,2013,/scholar?cites=17845927026039022236,IaLjS0kAAAAJ:qxL8FJ1GzNcC
1025016,"Dans le cadre des recherches sur les environnements informatiques pour l'apprentissage humain, cette thèse vise à définir et proposer à l'enseignant une mémoire informatisée comme outil de gestion de connaissances personnelles. Cette mémoire est construite a partir des annotations de l'enseignant sur les documents pédagogiques. La mémoire résultante étend les capacités cognitives de l'enseignant en l'assistant dans la gestion de ses connaissances personnelles, nécessaires à la réalisation de ses activités de manière non intrusive. La prise en compte des particularités de l'activité d'enseignement (connaissances impliquées, contexte de l'activité...) dans les modèles de la mémoire permet d'obtenir une mémoire qui est en même temps dédiée a l'activité d'enseignement et s' adapte au contexte de cette activité. Deux versions de l'outil sont développées: une version mobile et une version web (implémentée par l'entreprise Pentila) intégrable dans un ENT.",Faical Azouaou,14,13028613473020623191,,,,,Modèles et outils d'annotations pour une mémoire personnelle de l'enseignant,https://tel.archives-ouvertes.fr/tel-00118602/,,2006,/scholar?cites=13028613473020623191,IaLjS0kAAAAJ:UeHWp8X0CEIC
1025017,This article aims at proposing a flexible and extensible architecture for the context-aware annotation tool MemoNote dedicated to education. For that aim we define the configurations in which MemoNote must be able to adapt to context. The proposed architecture is assessed against scenarios based on these configurations,Faiçal Azouaou and Cyrille Desmoulins,12,12833585107590485937,,,22-26,IEEE,A flexible and extensible architecture for context-aware annotation in e-learning,https://ieeexplore.ieee.org/abstract/document/1652355/,,2006,/scholar?cites=12833585107590485937,IaLjS0kAAAAJ:qjMakFHDy7sC
1025018,"Arabizi is a form of writing Arabic text which relies on Latin letters, numerals and punctuation rather than Arabic letters. In the literature, the difficulties associated with Arabizi sentiment analysis have been underestimated, principally due to the complexity of Arabizi. In this paper, we present an approach to automatically classify sentiments of Arabizi messages into positives or negatives. In the proposed approach, Arabizi messages are first transliterated into Arabic. Afterwards, we automatically classify the sentiment of the transliterated corpus using an automatically annotated corpus. For corpus validation, shallow machine learning algorithms such as Support Vectors Machine (SVM) and Naive Bays (NB) are used. Simulations results demonstrate the outperformance of NB algorithm over all others. The highest achieved F1-score is up to 78% and 76% for manually and automatically transliterated dataset respectively. Ongoing work is aimed at improving the transliterator module and annotated sentiment dataset.",Imane Guellil and Ahsan Adeel and Faical Azouaou and Fodil Benali and Ala-eddine Hachani and Amir Hussain,11,8479352124170070827,,,335-341,,Arabizi sentiment analysis based on transliteration and automatic corpus annotation,https://www.aclweb.org/anthology/W18-6249.pdf,,2018,/scholar?cites=8479352124170070827,IaLjS0kAAAAJ:PaBasH6fAo0C
1025019,"Research on Arabic Dialect Treatment has recently become important in the literature. Although most work on these dialects considers only the messages or the portion of text written in Arabic letters, another style of writing has emerged on social media. This style is known by Arabizi and combines between Latin letters and numbers. To address this emergent problem in the context of automatic translation, we present an Arabic dialect translation system composed by two modules: Transliteration and translation. We develop each module with a statistical and a neural model. To test our system, we used the Algerian portion of a multidialectal Arabic corpus named PADIC. Experimental results show that a good transliteration improves the translation results. Moreover, the neural transliteration gives better results than the statistical transliteration. However, the statistical translation still gives better results that the neural translation.",Imane Guellil and Faiçal Azouaou and Mourad Abbas,11,10882086359281808960,,,1-5,,Comparison between neural and statistical translation after transliteration of algerian arabic dialect,https://www.researchgate.net/profile/Imane_Guellil/publication/318755190_Comparison_between_Neural_and_Statistical_translation_after_transliteration_of_Algerian_Arabic_Dialect/links/597b78b20f7e9b8802844cf4/Comparison-between-Neural-and-Statistical-translation-after-transliteration-of-Algerian-Arabic-Dialect.pdf,,2017,/scholar?cites=10882086359281808960,IaLjS0kAAAAJ:CaZNVDsoPx4C
1025020,"La fouille d’opinions et analyse de sentiments au sein des médias sociaux représente une piste de recherche suscitant un grand intérêt de la communauté scientifique. Néanmoins avant de procéder à cette analyse, nous sommes confrontés à un ensemble de problématiques. La première concerne la richesse des langues et dialectes au sein de ces médias. Afin de répondre à cette problématique, nous proposons dans ce papier une approche de construction et d’implémentation d’un analyseur syntaxique d’un dialecte arabe (le dialecte algérien) nommé ASDA servant à étiqueter les termes d’un corpus donné. Nous récupérons ainsi une table d’étiquetage contenant pour chaque terme son radicale, différents préfixes et suffixes, nous permettant de déterminer les différentes parties grammaticales, une sorte d’étiquetage POS 1. Cet étiquetage, nous servira par la suite dans le traitement sémantique de ce dialecte, c'est-à-dire la traduction automatique de ce dernier ainsi que l’analyse de sentiment de messages rédigés en ce dialecte",Imène Guellil and Faiçal Azouaou,9,15272898798796865586,arXiv preprint arXiv:1707.08998,,,,ASDA: Analyseur Syntaxique du Dialecte Alg {\'e} rien dans un but d'analyse s {\'e} mantique,https://arxiv.org/abs/1707.08998,,2017,/scholar?cites=15272898798796865586,IaLjS0kAAAAJ:lgwcVrK6X84C
1025021,"The arabizi is the combination between the latine letters and the number in the same word. The transliteration is the process of transforming the text from one alphabet to another. In our case, it consists to transform arabizi to Arabic. The transliteration is considered as the first compound of automatic translation when users combine between different alphabets to write.Almost all the work on Arabic Dialect Translation is based on statistical translation and we did not get any work on Neural translation. To bridge this gap, we propose in this paper an approach composed of two steps: 1) Transliteration and 2) Translation. In the two steps we call the neural network and compare the results with traditional statistical approach. We apply our approach on dialect spoken by over 40 million people and suffer from the lack of works that handle it. This dialect is Algerian Dialect and it is recognized by a high level of combination between Arabic and arabizi.",Imane GUELLIL and Faical AZOUAOU,9,1368410072880977858,,,,,Neural Vs Statistical Translation of Algerian Arabic Dialect written with Arabizi and Arabic letter,https://www.researchgate.net/profile/Imane_Guellil/publication/321670542_Neural_Vs_Statistical_Translation_of_Algerian_Arabic_Dialect_written_with_Arabizi_and_Arabic_letter/links/5a2a5226a6fdccfbbf81c30b/Neural-Vs-Statistical-Translation-of-Algerian-Arabic-Dialect-written-with-Arabizi-and-Arabic-letter.pdf,,2017,/scholar?cites=1368410072880977858,IaLjS0kAAAAJ:zCSUwVk65WsC
